{
  "eventId": "d2c1e472-5a7d-4c80-a310-387c643596b5",
  "eventType": "debtSettled",
  "eventVersion": "1.0",
  "occurredAt": "2026-10-26T11:00:00-03:00",
  "sourceModule": "rentas",
  "correlationId": "ca16af37-771a-4912-8e6a-1919c341a113",
  "causationId": null,
  "data": {
    "debtId": "91d91a42-3b08-4645-a89d-b65220eb69b4",
    "citizenId": "0d322adc-243e-43da-843a-4b9c63b78d57",
    "conceptCode": "TRAFFIC_INFRACTION",
    "originType": "TRAFFIC_FINE",
    "originId": "b63caa31-b8e1-4981-8348-ce40c0cb4490",
    "infractionId": "b63caa31-b8e1-4981-8348-ce40c0cb4490",
    "settledAt": "2026-10-26T11:00:00-03:00",
    "remainingBalance": 0.00,
    "outstandingBalance": 0.00
  }
}
