{
  "eventId": "4c712abe-b51f-4e09-9d32-b2ff31ce97b4",
  "eventType": "paymentRegistered",
  "eventVersion": "1.0",
  "occurredAt": "2026-10-26T10:00:00-03:00",
  "sourceModule": "rentas",
  "correlationId": null,
  "causationId": null,
  "data": {
    "paymentId": "78168ad3-372b-49bc-a08e-fbf69a2bfd5a",
    "debtId": "02c9affc-dcef-4d28-807b-fb530fd5f5f4",
    "originType": "PERMIT_FEE",
    "originId": "FEE-001",
    "amountApplied": 50000.00,
    "paidAt": "2026-10-26T10:00:00-03:00",
    "remainingBalance": 25000.00
  }
}
