{
  "eventId": "dd5501fb-377d-42ea-b4de-6f055e7f70ca",
  "eventType": "updatePaymentPlanStatus",
  "eventVersion": "1.0",
  "occurredAt": "2026-10-26T15:35:00Z",
  "sourceModule": "rentas",
  "correlationId": null,
  "causationId": null,
  "data": {
    "requestId": "7d6a54b0-5e58-4ed2-a1d1-94bde2fc1d41",
    "citizenId": "1bc4530b-27da-4f48-b7b6-03d27a7f0be4",
    "status": "GRANTED",
    "planId": "8bbdd0d5-0188-4828-8aae-d8872c5f0022",
    "installments": 6,
    "totalAmount": 218000.00
  }
}
